smartctl version 5.26 Copyright (C) 2002-3 Bruce Allen
Home page is http://smartmontools.sourceforge.net/

=== START OF INFORMATION SECTION ===
Device Model:     ST31000340AS
Serial Number:    9QJ0FFG7
Firmware Version: SD15
Device is:        Not in smartctl database [for details use: -P showall]
ATA Version is:   8
ATA Standard is:  Not recognized. Minor revision code: 0x29
Local Time is:    Sat May 10 19:30:51 2008 GST
SMART support is: Available - device has SMART capability.
SMART support is: Enabled

=== START OF READ SMART DATA SECTION ===
SMART overall-health self-assessment test result: PASSED

General SMART Values:
Offline data collection status:  (0x82)	Offline data collection activity was
					completed without error.
					Auto Offline Data Collection: Enabled.
Self-test execution status:      (   0)	The previous self-test routine completed
					without error or no self-test has ever 
					been run.
Total time to complete Offline 
data collection: 		 ( 625) seconds.
Offline data collection
capabilities: 			 (0x7b) SMART execute Offline immediate.
					Auto Offline data collection on/off support.
					Suspend Offline collection upon new
					command.
					Offline surface scan supported.
					Self-test supported.
					Conveyance Self-test supported.
					Selective Self-test supported.
SMART capabilities:            (0x0003)	Saves SMART data before entering
					power-saving mode.
					Supports SMART auto save timer.
Error logging capability:        (0x01)	Error logging supported.
					General Purpose Logging supported.
Short self-test routine 
recommended polling time: 	 (   1) minutes.
Extended self-test routine
recommended polling time: 	 ( 227) minutes.
Conveyance self-test routine
recommended polling time: 	 (   2) minutes.

SMART Attributes Data Structure revision number: 10
Vendor Specific SMART Attributes with Thresholds:
ID# ATTRIBUTE_NAME          FLAG     VALUE WORST THRESH TYPE      UPDATED  WHEN_FAILED RAW_VALUE
  1 Raw_Read_Error_Rate     0x000f   119   100   006    Pre-fail  Always       -       229921266
  3 Spin_Up_Time            0x0003   091   091   000    Pre-fail  Always       -       0
  4 Start_Stop_Count        0x0032   100   100   020    Old_age   Always       -       29
  5 Reallocated_Sector_Ct   0x0033   100   100   036    Pre-fail  Always       -       0
  7 Seek_Error_Rate         0x000f   056   054   030    Pre-fail  Always       -       42954193882
  9 Power_On_Hours          0x0032   100   100   000    Old_age   Always       -       306
 10 Spin_Retry_Count        0x0013   100   100   097    Pre-fail  Always       -       0
 12 Power_Cycle_Count       0x0032   100   100   020    Old_age   Always       -       29
184 Unknown_Attribute       0x0032   100   100   099    Old_age   Always       -       0
187 Unknown_Attribute       0x0032   100   100   000    Old_age   Always       -       0
188 Unknown_Attribute       0x0032   100   100   000    Old_age   Always       -       0
189 Unknown_Attribute       0x003a   100   100   000    Old_age   Always       -       0
190 Unknown_Attribute       0x0022   068   056   045    Old_age   Always       -       554631200
194 Temperature_Celsius     0x0022   032   044   000    Old_age   Always       -       32 (Lifetime Min/Max 0/15)
195 Hardware_ECC_Recovered  0x001a   038   033   000    Old_age   Always       -       229921266
197 Current_Pending_Sector  0x0012   100   100   000    Old_age   Always       -       0
198 Offline_Uncorrectable   0x0010   100   100   000    Old_age   Offline      -       0
199 UDMA_CRC_Error_Count    0x003e   200   200   000    Old_age   Always       -       0

SMART Error Log Version: 1
No Errors Logged

SMART Self-test log structure revision number 1
No self-tests have been logged.  [Use the smartctl -t option to run these.]


