smartctl version 5.38 [i686-pc-linux-gnu] Copyright (C) 2002-8 Bruce Allen
Home page is http://smartmontools.sourceforge.net/

=== START OF INFORMATION SECTION ===
Device Model:     FUJITSU MHW2080BH PL
Serial Number:    K10MT752EDUJ
Firmware Version: 891F
User Capacity:    80,026,361,856 bytes
Device is:        Not in smartctl database [for details use: -P showall]
ATA Version is:   7
ATA Standard is:  ATA/ATAPI-7 T13 1532D revision 4a
Local Time is:    Sun Mar 23 08:47:55 2008 CET
SMART support is: Available - device has SMART capability.
SMART support is: Enabled

=== START OF READ SMART DATA SECTION ===
SMART overall-health self-assessment test result: PASSED

General SMART Values:
Offline data collection status:  (0x00)	Offline data collection activity
					was never started.
					Auto Offline Data Collection: Disabled.
Self-test execution status:      (   0)	The previous self-test routine completed
					without error or no self-test has ever 
					been run.
Total time to complete Offline 
data collection: 		 ( 324) seconds.
Offline data collection
capabilities: 			 (0x51) SMART execute Offline immediate.
					No Auto Offline data collection support.
					Suspend Offline collection upon new
					command.
					No Offline surface scan supported.
					Self-test supported.
					No Conveyance Self-test supported.
					Selective Self-test supported.
SMART capabilities:            (0x0003)	Saves SMART data before entering
					power-saving mode.
					Supports SMART auto save timer.
Error logging capability:        (0x01)	Error logging supported.
					General Purpose Logging supported.
Short self-test routine 
recommended polling time: 	 (   2) minutes.
Extended self-test routine
recommended polling time: 	 (  46) minutes.
SCT capabilities: 	       (0x003f)	SCT Status supported.
					SCT Feature Control supported.
					SCT Data Table supported.

SMART Attributes Data Structure revision number: 16
Vendor Specific SMART Attributes with Thresholds:
ID# ATTRIBUTE_NAME          FLAG     VALUE WORST THRESH TYPE      UPDATED  WHEN_FAILED RAW_VALUE
  1 Raw_Read_Error_Rate     0x000f   100   100   046    Pre-fail  Always       -       64242
  2 Throughput_Performance  0x0005   100   100   030    Pre-fail  Offline      -       19398656
  3 Spin_Up_Time            0x0003   100   100   025    Pre-fail  Always       -       1
  4 Start_Stop_Count        0x0032   099   099   000    Old_age   Always       -       1084
  5 Reallocated_Sector_Ct   0x0033   100   100   024    Pre-fail  Always       -       8589934592000
  7 Seek_Error_Rate         0x000f   100   100   047    Pre-fail  Always       -       1466
  8 Seek_Time_Performance   0x0005   100   100   019    Pre-fail  Offline      -       0
  9 Power_On_Hours          0x0032   096   096   000    Old_age   Always       -       2316
 10 Spin_Retry_Count        0x0013   100   100   020    Pre-fail  Always       -       0
 12 Power_Cycle_Count       0x0032   100   100   000    Old_age   Always       -       559
182 Unknown_Attribute       0x0032   100   100   000    Old_age   Always       -       0
184 Unknown_Attribute       0x0032   253   253   000    Old_age   Always       -       0
185 Unknown_Attribute       0x0010   253   253   000    Old_age   Offline      -       0
186 Unknown_Attribute       0x0032   253   253   000    Old_age   Always       -       0
187 Reported_Uncorrect      0x0032   100   100   000    Old_age   Always       -       0
188 Unknown_Attribute       0x0032   100   100   000    Old_age   Always       -       0
189 High_Fly_Writes         0x003a   100   100   000    Old_age   Always       -       0
190 Airflow_Temperature_Cel 0x0022   068   056   000    Old_age   Always       -       32 (Lifetime Min/Max 20/33)
191 G-Sense_Error_Rate      0x0032   253   253   000    Old_age   Always       -       16580608
192 Power-Off_Retract_Count 0x0032   100   100   000    Old_age   Always       -       983055
193 Load_Cycle_Count        0x0032   099   099   000    Old_age   Always       -       35786
195 Hardware_ECC_Recovered  0x001a   100   100   000    Old_age   Always       -       198
196 Reallocated_Event_Count 0x0032   100   100   000    Old_age   Always       -       434765824
197 Current_Pending_Sector  0x0012   100   100   000    Old_age   Always       -       0
198 Offline_Uncorrectable   0x0010   100   100   000    Old_age   Offline      -       0
199 UDMA_CRC_Error_Count    0x003e   200   200   000    Old_age   Always       -       0
200 Multi_Zone_Error_Rate   0x000f   100   100   060    Pre-fail  Always       -       4149
203 Run_Out_Cancel          0x0002   100   100   000    Old_age   Always       -       429508525183
240 Head_Flying_Hours       0x003e   200   200   000    Old_age   Always       -       0

SMART Error Log Version: 1
No Errors Logged

SMART Self-test log structure revision number 1
Num  Test_Description    Status                  Remaining  LifeTime(hours)  LBA_of_first_error
# 1  Short offline       Completed without error       00%      2316         -
# 2  Short offline       Completed without error       00%        10         -
# 3  Short offline       Completed without error       00%        10         -
# 4  Short offline       Completed without error       00%        10         -
# 5  Short offline       Completed without error       00%        10         -
# 6  Short offline       Completed without error       00%         9         -
# 7  Short offline       Completed without error       00%         9         -
# 8  Short offline       Completed without error       00%         9         -
# 9  Short offline       Completed without error       00%         9         -
#10  Short offline       Completed without error       00%         8         -
#11  Short offline       Completed without error       00%         8         -
#12  Short offline       Completed without error       00%         8         -
#13  Short offline       Completed without error       00%         8         -
#14  Short offline       Completed without error       00%         7         -
#15  Short offline       Completed without error       00%         7         -
#16  Short offline       Completed without error       00%         7         -
#17  Short offline       Completed without error       00%         3         -
#18  Short offline       Completed without error       00%         2         -
#19  Short offline       Completed without error       00%         2         -
#20  Short offline       Completed without error       00%         1         -
#21  Short offline       Completed without error       00%         1         -

SMART Selective self-test log data structure revision number 1
 SPAN  MIN_LBA  MAX_LBA  CURRENT_TEST_STATUS
    1        0        0  Not_testing
    2        0        0  Not_testing
    3        0        0  Not_testing
    4        0        0  Not_testing
    5        0        0  Not_testing
Selective self-test flags (0x0):
  After scanning selected spans, do NOT read-scan remainder of disk.
If Selective self-test is pending on power-up, resume after 0 minute delay.

