smartctl version 5.37 [i686-pc-linux-gnu] Copyright (C) 2002-6 Bruce Allen
Home page is http://smartmontools.sourceforge.net/

=== START OF INFORMATION SECTION ===
Device Model:     Hitachi HTS721080G9SA00
Serial Number:    MPCDN7Y4HS5Y0L
Firmware Version: MC4OC10H
User Capacity:    80 026 361 856 bytes
Device is:        Not in smartctl database [for details use: -P showall]
ATA Version is:   7
ATA Standard is:  ATA/ATAPI-7 T13 1532D revision 1
Local Time is:    Mon Feb 11 19:37:38 2008 CET
SMART support is: Available - device has SMART capability.
SMART support is: Enabled

=== START OF READ SMART DATA SECTION ===
SMART overall-health self-assessment test result: PASSED

General SMART Values:
Offline data collection status:  (0x82)	Offline data collection activity
					was completed without error.
					Auto Offline Data Collection: Enabled.
Self-test execution status:      (   0)	The previous self-test routine completed
					without error or no self-test has ever 
					been run.
Total time to complete Offline 
data collection: 		 ( 645) seconds.
Offline data collection
capabilities: 			 (0x5b) SMART execute Offline immediate.
					Auto Offline data collection on/off support.
					Suspend Offline collection upon new
					command.
					Offline surface scan supported.
					Self-test supported.
					No Conveyance Self-test supported.
					Selective Self-test supported.
SMART capabilities:            (0x0003)	Saves SMART data before entering
					power-saving mode.
					Supports SMART auto save timer.
Error logging capability:        (0x01)	Error logging supported.
					General Purpose Logging supported.
Short self-test routine 
recommended polling time: 	 (   2) minutes.
Extended self-test routine
recommended polling time: 	 (  45) minutes.

SMART Attributes Data Structure revision number: 16
Vendor Specific SMART Attributes with Thresholds:
ID# ATTRIBUTE_NAME          FLAG     VALUE WORST THRESH TYPE      UPDATED  WHEN_FAILED RAW_VALUE
  1 Raw_Read_Error_Rate     0x000b   100   100   062    Pre-fail  Always       -       0
  2 Throughput_Performance  0x0004   117   117   000    Old_age   Offline      -       3342
  3 Spin_Up_Time            0x0007   220   220   033    Pre-fail  Always       -       1
  4 Start_Stop_Count        0x0012   100   100   000    Old_age   Always       -       442
  5 Reallocated_Sector_Ct   0x0033   100   100   005    Pre-fail  Always       -       0
  7 Seek_Error_Rate         0x000a   100   100   000    Old_age   Always       -       0
  8 Seek_Time_Performance   0x0004   118   118   000    Old_age   Offline      -       37
  9 Power_On_Hours          0x0012   096   096   000    Old_age   Always       -       1786
 10 Spin_Retry_Count        0x0012   100   100   000    Old_age   Always       -       0
 12 Power_Cycle_Count       0x0032   100   100   000    Old_age   Always       -       420
191 G-Sense_Error_Rate      0x000a   100   100   000    Old_age   Always       -       0
192 Power-Off_Retract_Count 0x0032   099   099   000    Old_age   Always       -       313
193 Load_Cycle_Count        0x0012   099   099   000    Old_age   Always       -       15851
194 Temperature_Celsius     0x0002   144   144   000    Old_age   Always       -       38 (Lifetime Min/Max 15/48)
196 Reallocated_Event_Count 0x0032   100   100   000    Old_age   Always       -       137
197 Current_Pending_Sector  0x0022   100   100   000    Old_age   Always       -       3
198 Offline_Uncorrectable   0x0008   100   100   000    Old_age   Offline      -       0
199 UDMA_CRC_Error_Count    0x000a   200   253   000    Old_age   Always       -       0

SMART Error Log Version: 1
ATA Error Count: 3
	CR = Command Register [HEX]
	FR = Features Register [HEX]
	SC = Sector Count Register [HEX]
	SN = Sector Number Register [HEX]
	CL = Cylinder Low Register [HEX]
	CH = Cylinder High Register [HEX]
	DH = Device/Head Register [HEX]
	DC = Device Command Register [HEX]
	ER = Error register [HEX]
	ST = Status register [HEX]
Powered_Up_Time is measured from power on, and printed as
DDd+hh:mm:SS.sss where DD=days, hh=hours, mm=minutes,
SS=sec, and sss=millisec. It "wraps" after 49.710 days.

Error 3 occurred at disk power-on lifetime: 408 hours (17 days + 0 hours)
  When the command that caused the error occurred, the device was active or idle.

  After command completion occurred, registers were:
  ER ST SC SN CL CH DH
  -- -- -- -- -- -- --
  10 51 08 ef 2d fb e2  Error: IDNF 8 sectors at LBA = 0x02fb2def = 50015727

  Commands leading to the command that caused the error were:
  CR FR SC SN CL CH DH DC   Powered_Up_Time  Command/Feature_Name
  -- -- -- -- -- -- -- --  ----------------  --------------------
  c8 00 08 ef 2d fb e2 08      04:50:22.700  READ DMA
  ca 00 08 07 39 db e2 08      04:50:22.700  WRITE DMA
  ca 00 08 e7 3c 9c e8 08      04:50:22.700  WRITE DMA
  ca 00 40 c7 38 db e2 08      04:50:22.700  WRITE DMA
  ca 00 18 cf 3c 9c e8 08      04:50:22.700  WRITE DMA

Error 2 occurred at disk power-on lifetime: 408 hours (17 days + 0 hours)
  When the command that caused the error occurred, the device was active or idle.

  After command completion occurred, registers were:
  ER ST SC SN CL CH DH
  -- -- -- -- -- -- --
  10 51 a0 4f 65 4a e2  Error: IDNF 160 sectors at LBA = 0x024a654f = 38430031

  Commands leading to the command that caused the error were:
  CR FR SC SN CL CH DH DC   Powered_Up_Time  Command/Feature_Name
  -- -- -- -- -- -- -- --  ----------------  --------------------
  c8 00 a0 4f 65 4a e2 08      04:50:09.200  READ DMA
  c8 00 08 ed d9 eb e1 08      04:50:09.200  READ DMA
  c8 00 08 e5 d8 eb e1 08      04:50:09.200  READ DMA
  c8 00 08 b5 d8 eb e1 08      04:50:09.100  READ DMA
  c8 00 08 bd 40 ea e1 08      04:50:09.100  READ DMA

Error 1 occurred at disk power-on lifetime: 1 hours (0 days + 1 hours)
  When the command that caused the error occurred, the device was active or idle.

  After command completion occurred, registers were:
  ER ST SC SN CL CH DH
  -- -- -- -- -- -- --
  10 51 01 81 23 51 e9  Error: IDNF 1 sectors at LBA = 0x09512381 = 156312449

  Commands leading to the command that caused the error were:
  CR FR SC SN CL CH DH DC   Powered_Up_Time  Command/Feature_Name
  -- -- -- -- -- -- -- --  ----------------  --------------------
  c8 ff 01 81 23 51 e9 08      00:10:58.200  READ DMA
  c8 ff 01 00 00 00 e0 08      00:09:37.700  READ DMA
  c8 ff 01 00 00 00 e0 08      00:09:37.700  READ DMA
  c8 ff 01 00 00 00 e0 08      00:09:37.700  READ DMA
  c8 ff 01 00 00 00 e0 08      00:09:37.700  READ DMA

SMART Self-test log structure revision number 1
Num  Test_Description    Status                  Remaining  LifeTime(hours)  LBA_of_first_error
# 1  Short offline       Completed without error       00%      1786         -
# 2  Short offline       Completed without error       00%       714         -
# 3  Short offline       Completed without error       00%         1         -
# 4  Short offline       Completed without error       00%         0         -

Warning! SMART Selective Self-Test Log Structure error: invalid SMART checksum.
SMART Selective self-test log data structure revision number 1
 SPAN  MIN_LBA  MAX_LBA  CURRENT_TEST_STATUS
    1        0        0  Not_testing
    2        0        0  Not_testing
    3        0        0  Not_testing
    4        0        0  Not_testing
    5        0        0  Not_testing
Selective self-test flags (0x0):
  After scanning selected spans, do NOT read-scan remainder of disk.
If Selective self-test is pending on power-up, resume after 0 minute delay.

