smartctl version 5.38 [i686-pc-linux-gnu] Copyright (C) 2002-8 Bruce Allen
Home page is http://smartmontools.sourceforge.net/

=== START OF INFORMATION SECTION ===
Device Model:     ST32120A
Serial Number:    XJ696691
Firmware Version: 0.34
User Capacity:    2,111,864,832 bytes
Device is:        Not in smartctl database [for details use: -P showall]
ATA Version is:   2
ATA Standard is:  Not recognized. Minor revision code: 0xffff
Local Time is:    Sun Mar  9 17:23:32 2008 UTC
SMART is only available in ATA Version 3 Revision 3 or greater.
We will try to proceed in spite of this.
SMART support is: Ambiguous - ATA IDENTIFY DEVICE words 85-87 don't show if SMART is enabled.
                  Checking to be sure by trying SMART RETURN STATUS command.
SMART support is: Enabled

=== START OF READ SMART DATA SECTION ===
SMART overall-health self-assessment test result: PASSED

General SMART Values:
Offline data collection status:  (0x00)	Offline data collection activity
					was never started.
					Auto Offline Data Collection: Disabled.
Total time to complete Offline 
data collection: 		 (   0) seconds.
Offline data collection
capabilities: 			 (0x03) SMART execute Offline immediate.
					Auto Offline data collection on/off support.
					Suspend Offline collection upon new
					command.
					No Offline surface scan supported.
					No Self-test supported.
					No Conveyance Self-test supported.
					No Selective Self-test supported.
SMART capabilities:            (0x0002)	Does not save SMART data before
					entering power-saving mode.
					Supports SMART auto save timer.
Error logging capability:        (0x00)	Error logging NOT supported.
					No General Purpose Logging support.

SMART Attributes Data Structure revision number: 5
Vendor Specific SMART Attributes with Thresholds:
ID# ATTRIBUTE_NAME          FLAG     VALUE WORST THRESH TYPE      UPDATED  WHEN_FAILED RAW_VALUE
  1 Raw_Read_Error_Rate     0x000a   116   100   000    Old_age   Always       -       119455664
  3 Spin_Up_Time            0x0006   096   096   000    Old_age   Always       -       4
  4 Start_Stop_Count        0x0013   099   099   020    Pre-fail  Always       -       1411
  5 Reallocated_Sector_Ct   0x0013   100   100   036    Pre-fail  Always       -       0
  7 Seek_Error_Rate         0x000b   048   043   030    Pre-fail  Always       -       1687947712760
 10 Spin_Retry_Count        0x0013   100   100   097    Pre-fail  Always       -       0
 12 Power_Cycle_Count       0x0013   100   100   020    Pre-fail  Always       -       1019

Warning: device does not support Error Logging
Error SMART Error Log Read failed
Smartctl: SMART Error Log Read Failed
Warning: device does not support Self Test Logging
Error SMART Error Self-Test Log Read failed
Smartctl: SMART Self Test Log Read Failed
Device does not support Selective Self Tests/Logging
